<?xml version="1.0" encoding="UTF-8"?>

<experiment
    xmlns:xsi='http://www.w3.org/2001/XMLSchema-instance'
    xsi:noNamespaceSchemaLocation='xsd-scheme/experiments.xsd'>
    <secretid>lkjfds;alkfjv</secretid>
    <title>Franssen</title>
    <description>
        generated libraries from flowers, leaves, cotyledons, 
        epi- and hypocotyl, and etiolated and light treated etiolated seedlings
    </description>
    <runs>
        <run>
            <secretid>slkjxvmllkeg</secretid>
            <title>COT</title>
            <species>3888</species>
            <source>cotyledons</source>
            <platform>LS454</platform>
        </run>
    </runs>
</experiment>
